"myMonth","myDay","title","myBook","body","id"
"4","26","Super Bowl Sunday","A Word From Home","<p><em>The Lord will make a list of those who are His and will take into consideration where they were born. </em>Psalms 87:6, Clear Word.</p><p>It was the Big Day--Super Bowl Sunday, January 26, 2003. The Tampa Bay Buccaneers and the Oakland Raiders were playing in San Diego, California. My husband was excited and wanted me to share in his enthusiasm for the game.</p><p>You will need to understand the difference in our backgrounds. Bill's mother died when he was 3, and his father when he was 5. Since his dad had been an engineer on the railroad, he and his two older brothers were sent to Junior Order Home in Tiffin, Ohio, in 1920. There, he and 1,000 other children were well nourished, clothed, and schooled. They were also thoroughly immersed in sports, including baseball and football. He proudly showed me the stadium where they played when we visited there after we married.</p><p>The only other person we know who was in the Home at the same time Bill lived there, and later joined our church, was Robert Francois. He learned linotype while in the Home and later used that training to work his way through the theology course, becoming a professor of religion. Before his death, he and Bill enjoyed reminiscing about the sports program at Tiffin.</p><p>As for my background, my family was very poor. The eldest of seven children, I learned early in life to enjoy work more than play--and still do! So I can't get enthusiastic about Bill's game, though he has begged me to watch at least the first quarter with him as he patiently explains the different plays and interprets the signals of the referee.</p><p>So I decided that instead of thinking it a waste of time, I could pray for each player. Bill pointed out one of the team members who was religious and could be seen making the sign of the cross while on the field. He assured me that their team would win the game.</p><p>It was estimated that 8 million people around the world, including the soldiers preparing for war with Iraq, watched that game. I'm not sure what the Lord thinks about football, but I do know He loves all those players out there on the field, and I trust Him to answer my prayers on their behalf.</p><p>By the way, the Bucs won, 48-21!</p><p><DIV ALIGN=RIGHT>--Rubye Sue</div></p>","116"
"4","27","Procrastination","A Word From Home","<p><em>Thou wilt keep him in perfect peace, whose mind is stayed on thee: because he trusteth in thee.</em> Isaiah 26:3.</p><p>Throughout my developing years and into my adult life, my mother often said to me, \"Never put off for tomorrow what you can do today; tomorrow you may never see the rising of the sun.\" I don't know where she got that saying, but it has proven to be true. Perhaps she observed that I was always putting off doing things. I'm one of those people who have to think things through before coming to a decision; meanwhile, time and opportunities pass by.</p><p>The building of the church where I worship was recently completed, and it was decided to have a grand opening celebration. This necessitated having a souvenir journal, and a drive was on to solicit donations. I mailed letters to friends far away, but because of time constraints I decided to deliver letters to my neighbors personally. One neighbor in particular I was impressed to visit. As I passed her house on my travels, I'd look over and think,<em> I have to stop by.</em> But I never did. It was always <em>I will do it tomorrow. </em>But tomorrow never came.</p><p>One morning as I left home to run errands I decided, Today, on my way back, I will stop. I even took a copy of Steps to Christ with me in case I hadn't given her one before. My intentions that morning were all good. There was even a strong prompting by the Holy Spirit to visit her. But I still did not stop. </p><p>That night guilt overwhelmed me. I decided not to let another day go by without calling, regardless of the lateness of the hour. I'm glad I did. When her husband answered the phone, I asked, \"May I speak with Phyllis?\"</p><p>\"She is no longer here,\" he replied. \"She left yesterday.\" I didn't grasp what he meant. Recognizing the hesitation in my voice he added, \"She died yesterday.\"</p><p>Never put off for tomorrow what you can do today. It could be someone's last day--or it could be yours or mine.</p><p><em>Lord, please help me to be obedient to the Holy Spirit and not pass up the opportunity to be of service to others while there is still time.</em></p><p><DIV ALIGN=RIGHT>--Dolores Smith</div></p>","117"
"4","28","All Things Work Together for Good","A Word From Home","<p><em>And we know that all things work together for good to them that love God, to them who are the called according to his purpose. </em>Romans 8:28.</p><p>I learned early on that one of the most important things a Christian must do is attend prayer meeting on a regular basis. Herein lies power and a constant source of encouragement and strength. I have also learned that it is safe to depend on this weekly spiritual nourishment and sheer joy to drink in the rich fellowship shared with other spiritual believers.</p><p>Rushing to church one prayer meeting night to be sure not be late, I hurried across the street to the bus stop. <em>Oh, here it comes! </em>I thought. Confident that the driver saw me, I ran across the street, waving to attract his attention, fully expecting him to pull to a stop and let me on. He did not. He didn't even slow down.</p><p>I couldn't believe it! Why would the Lord let this happen to me? He knew my purpose in going to prayer meeting. He knew missing that particular bus would also mean missing the connecting bus, which would get me to the church late. Oh, how I hurt, feeling that the Lord had forsaken me. Didn't He want me to go to prayer meeting? Sulking, I waited impatiently for the next bus, my thoughts running wildly into the net of doubt. I felt as if God were far away.</p><p>Then a strange thing happened. A car approached and pulled to the curb directly in front of me. A friend poked his head out of the window and asked if I wanted a ride. I gladly got into the car, and he took me directly to the church door.</p><p>How chagrined I felt for having chided the Lord. Has He not promised, \"And we know that all things work together for good to them that love God, to them who are the called according to His purpose\"? He can make even a missed bus work together for our good.</p><p>God cares about every little thing that concerns us, and He meets our needs in many unexpected ways. I felt so grateful, for He had saved me both time and money, and I had arrived at church not only on time but early.</p><p>Trust Him. He never fails.</p><p><DIV ALIGN=RIGHT>--Audre B. Taylor</div></p>","118"
"4","29","Colors of Cheer","A Word From Home","<p><em>Children are a gift from God; they are his reward.\" </em>Psalms 127:3, TLB.</p><p>\"Come on Auntie! Let's paint!\" my 3-year-old nephew, Brendan, exclaimed. Smiling, I scurried to the table and sank into the chair beside him. Then, gazing out the window, lost in the white wonderland of snow, I sighed at the gray sky producing freezing flakes.</p><p>\"Auntie, look at this!\" Brendan cried as his brush swiped broadly across the paper. </p><p>But the only colors I saw were as gray as the sky above us. The dreary New York weather was in sharp contrast to the mild California winter I'd left behind to assist my sister, Lisa, with Brendan, and his little brother Cameron during her husband's military deployment.</p><p>Despite the blessings, I was lost in a fog and couldn't see my way out. It felt as though nothing mattered anymore as I struggled each morning to climb out of bed. Two years before an illness had taken over my life with depression, a vicious cycle of the illness. Brendan and Cameron were the bright spots of this ongoing battle.</p><p>\"Auntie, come on! Paint with me!\" Brendan implored. Obediently, I picked up a brush. \"OK, Auntie, here's what you do\" he commanded. </p><p>I paused. What color should I choose? None looked very cheery to me. Looking over, I observed Brendan painting only with black. \"Bren, I don't see any color. </p><p>Startled he replied, \"Auntie, there's a little blue right there!\"--plopping his finger into a puddle of paint. Looking closely, I saw a blur of blue paint mixed with his black clouds.</p><p>\"You're right! There is some color there!\" I exclaimed, sweeping my paintbrush across the soggy paper. </p><p>\"That's it Auntie! You're painting just like me!\" Brendan encouraged.</p><p>When circumstances fall beyond our control, God is there encouraging us. Can't you hear His cries of exuberance? \"My child, come on, paint with me!\" I couldn't see any color on that gray day, yet Brendan could see what I couldn't.</p><p>Not long after this experience the world opened up with color, if only for a day. God used my small nephew to brighten \"just a little bit\" of my world when all I could see was darkness. I can hear Jesus echoing Brendan's words: \"Can't you see it? There's a little bit of color here.\"</p><p><DIV ALIGN=RIGHT>--Lori L. Mantz</div></p>","119"
"4","30","My Silent Prayer","A Word From Home","<p><em>And after the earthquake a fire, but the Lord was not in the fire; and after the fire [a sound of gentle stillness and] a still, small voice. </em>1 Kings 19:12, Amplified.</p><p>When I was a little girl I remember hearing my businessman father come home and tell my mother about his day. Many times he mentioned that \"So-and-so can go on with that deal now; he's found a silent partner.\"</p><p>I wondered what a silent partner was. One day I asked him.</p><p>\"A silent partner,\" my father explained, \"is when two people start a business project. One person has the know-how, and he's up front doing what needs to be done. The other person doesn't do any of the work or have much to say about how it should be done, but he provides the money to get the project started. He's the silent partner. One can't function without the other.\"</p><p>That simple explanation was enough for me then, and even now I use it to illustrate a point. All my life I have been a doer. If I saw anything that needed to be done, I couldn't rest until it was done by me or someone else. I often acted too soon, spoke too fast, gave help where it wasn't needed, or barged into someone else's domain. My good deeds were often misunderstood, and I spent a great deal of time explaining or apologizing, feeling unhappy and full of remorse when neither of those options was possible.</p><p>Now that I'm older and learning more about living a Christian life, I have a Silent Partner to work along with me. My Silent Partner provides not only money but everything else I need. Unlike other silent partners, He also gives direction and knowledge. He doesn't interfere with what I plan to do unless I ask His advice, then He provides me with printed instructions.</p><p>He has even given me a special \"hotline\" I can use at any time or in any place. I talk over my problems with Him, and He immediately understands. If I wait quietly, I hear His reply in a still small voice that seems to come from inside me. He doesn't speak aloud, but His directions are so clear that He doesn't need to. If I begin to do something wrong He is quick to point out my error. If I persist and end up in disaster, He doesn't gloat or berate. He helps me pick up the pieces and start again.</p><p>My Silent Partner's name is Jesus Christ, and He wants to help you, too.</p><p><DIV ALIGN=RIGHT>--Goldie Down</div></p>","120"
"5","1","How Human Beings Live Well","Fit Forever: One-A-Day Devotionals for Body, Mind, and Spirit","<p><em>How good and pleasant it is when brothers [human beings] live together in unity! </em>Psalms 133:1, NIV.</p><p>Here's my take on being human and, beyond that, living well. It is the nature of being human that we make mistakes, that we occasionally offend one another, and that we sometimes fail in our efforts to live well. Genetics, temperament, environment, and habit may each play a role in our clumsy behaviors. Nothing, however, exceeds the fact that we are, first of all, human beings. Fundamentally, being human is what we're designed for. It's our generic self, much like the automobile we drive away when we pay only the base price.</p><p>For a human being to live well, however, requires something more. It implies physical, emotional, and spiritual health, none of which carries a particularly high price tag. It has to do with our desire to rise above generic living and above our ability to simply exist. It implies at least a measure of physical fitness. It involves emotionally healthy relationships, intimacy, and genuine forgiveness. It involves connecting with a God who says: \"Here I am. Trust Me. We need each other. I hope you'll accept Me and let Me be a part of your life.\"</p><p>A wise and loving God created within us the gifts to succeed and the ability to fail. As human beings, we do plenty of both. Out of the balance of success and failure, however, we derive character, humility, integrity of mind and spirit, and we experience both joy and grief. Living well is not so much about success or achievement, nor is it about the absence of humiliation or sadness; we need all of those experiences. Living well spiritually, emotionally, and even physically is all about process. Golfers have a saying: \"It's not how you drive, it's how you arrive.\" The process between the tee and the green is what matters. </p><p>Living well is about correcting mistakes while trying to avoid their repetition. Living well is about apologizing to those we offend while trying to avoid repeated offenses. Living well is about making  choices that reduce the magnitude, frequency, and consequences of our failures.</p><p>Living well is to view, to behave, and to respect all others as we would have them view us, behave toward us, and respect us. This is the plain and simple golden rule of a human being's life well lived. It is Christ's life reflected in our lives.</p><p><em>Thank You, Lord, for creating us human, with all the potential of living well.</em><DIV ALIGN=RIGHT>--Leonard L. Bailey</div></p>","121"
"5","3","A Mind-boggling Communication System","Fit Forever: One-A-Day Devotionals for Body, Mind, and Spirit","<p><em>Let this mind be in you, which was also in Christ Jesus.</em> Philippians 2:5.</p><p>The key to clear thinking has to do with the healthy communication of billions of neurons (nerve cells) that conduct impulses from one part of the body to another.</p><p>Let me give you a small idea of how mind-boggling the process is: Each neuron in your brain can carry on several million different conversations at the same time. No, you're not going crazy. This is normal. A single neuron can receive signals from more than 1,000 other neurons. And these electrical impulses take differing routes and speeds. Some take express routes. Light is bright--you squint your eyes. The dish is hot--you remove your hand quickly. Reflex actions like these travel first to the spinal cord, where the nerve impulse to pull your hand away is initiated; then it travels to the brain. Interestingly, messages sent through pain receptors can travel as slowly as 2 mph, whereas the signal from a kiss travels at an amazing 140 mph! We were created for love!</p><p>To picture the working brain, we might think of viewing New York City from the sky, with cars going in all directions and yet all is orderly and each part is in tune with the others. However, the perfection with which our minds function can become damaged, blunted, or shattered. In addition to injuries or illnesses, the type of stimuli we feed into our systems can distort the perception or interpretation of the information. The communication within can go awry. Neurons (including the chemicals, neurotransmitters and hormones that regulate them, their circuitry, and the electrical impulses that flow through them) make you, <em>you</em> and me, <em>me</em>. We're not all wired the same. Each nerve pathway and connection has been constructed experience by experience, choice by choice.</p><p>We were created for an incredible amount of communication or stimuli reception. Not only are our brains capable of immense amounts of storage, but their programming and reprogramming occur largely as a result of information, chemicals, and stimuli that enter through the avenue of the five senses. What we do with this information or stimuli plays a part in shaping our lives.</p><p>The Lord desires to infuse our senses with information that will cause our hearts to beat with His, our minds to long for His will, and our love to be set upon Him.</p><p><em>Lord, help me to guard my senses so I can have what You created me to experience: Your mind in me--as it was in Your Son, Jesus.</em></p><p><DIV ALIGN=RIGHT>--Ris&#235; Rafferty</div></p>","123"
"5","4","God's Home Run for You","Fit Forever: One-A-Day Devotionals for Body, Mind, and Spirit","<p><em>For all the promises of God in Him are Yes, and in Him Amen, to the glory of God through us. </em>2 Corinthians 1:20, NKJV.</p><p>Shawn Butler was dying of cancer at age 7. His frail, weak body was sinking into a coma. Cancer had infiltrated 90 percent of his brain. On August 9, 1982, Shawn's father agreed with the physicians that if he stopped breathing they would not try to revive him.<.p><p>But four days later something remarkable occurred. Red Sox first baseman Dace Stapleton, Shawn's hero, paid him a visit. Upon hearing the voice of the sports champion, Shawn actually awoke from his comatose state and talked for a few minutes about baseball. Then Stapleton leaned over the bed and made a promise. \"Tomorrow,\" he stated, \"I'm going to hit one over the fence just for you.\" Shawn's eyes lit up. During the Red Sox game the following day, when Dace Stapleton first came up to bat he had a determination in his gait. With a steely gleam in his eye he knocked the ball over the left field wall for a home run.</p><p>Five months later, Shawn's doctors were mystified. They could find no trace of the malignancy. The boy seemed almost completely recovered. His family was even planning a trip to Disney World. 
 What made the difference? Some believe it was hope. Shawn's hero made a promise and fulfilled that promise. Possibly, by doing so, he opened a door of hope for Shawn.</p><p>As we begin a new year, it stands before us full of hope. New beginnings and new opportunities. But sometimes optimism fades into disappointment. We discover our lack of ability to make lasting change. We fail to seize the moment. At those times we need to remember that \"the Lord is not slack concerning his promise\" (2 Peter 3:9). And His promise is \"I will not fail thee, nor forsake thee\" (Joshua 1:5). In addition, Psalm 37:4, 5 offers the assurance that God will give us the desires of our hearts.</p><p>In 2 Corinthians 1:20 the apostle Paul says that all God's promises find their \"yes\" in Jesus. He is the key. Jesus imparts power to live a new life and make hope a reality. Rivet your eyes on Him. He will never disappoint.</p><p><em>What changes do you want to make in your life? Put your hope in Christ and rejoice as He hits a home run for you this year!</em></p><p><DIV ALIGN=RIGHT>--Michael Cauley</div></p>","124"
"5","5","Getting in Gear","Fit Forever: One-A-Day Devotionals for Body, Mind, and Spirit","<p><em>Beloved, I pray that you may prosper in all things and be in health, just as your soul prospers. </em>3 John 2, NKJV.</p><p>Starting a fitness program--and sticking with it--may be one of the most challenging tasks you'll ever face. To be successful, you must commit to get fit. Humans are creatures of habit. Adopting a new lifestyle requires breaking old, ingrained habits and forging new and perhaps unfamiliar ones. Many meet their Waterloo on this first step because their decision is based on emotional enthusiasm rather than a disciplined commitment. When the going gets tough (it will) and the emotional highs fade (they will), the strength of your commitment must carry you through.</p><p>Decide that you will be a person of your word--with your reputation on the line. Put your resolution in writing and place it where it will continually remind you.</p><p>Ask for divine strength to support you. Remember that your body is a temple of the Holy Spirit. As you strengthen your physical body He is better able to communicate with you spiritually. The Lord has promised His power to those who ask for it. Develop an awareness that He is beside you when the going gets difficult. Claim God's promise in Jeremiah 30:17: \"I will restore you to health and heal your wounds\" (NIV).</p><p>Ask others to help keep you accountable. Make your decisions public. Public pledges are difficult to break because you don't want to let others down.</p><p>What else do you need in order to keep your commitment? Here's a list of essentials: (1) Have a definite plan, but avoid inflexibility. (2) Make modest beginning goals. Drastic changes may be necessary if serious health hazards need to be dealt with but, generally speaking, excessive goals set you up for failure. (3) Make your plan a part of your daily life. (4) Go for moderation and balance. (5) Expect progress to be gradual. If it took years to get out of shape it will takes months to get it back. (6) Enjoy the process, not just the end product. (7) Don't be too hard on yourself. Old habits die hard. (8) Monitor your progress on a regular basis, but don't be obsessive. (9) Follow the 90/10 rule rather than the 100/0 rule. Go for 90 percent compliance. Cut yourself a little slack, rather than wallow in guilt. (10) Give credit where credit is due; thank the Lord for your success.</p><p><em>What lifestyle changes would you like to make this year to help you become the person you really want to be? Today's a great day to start getting in gear!</em></p><p><DIV ALIGN=RIGHT>--Elmar P. Sakala</div></p>","125"
"5","6","Sleeping the Sleep of the Righeous","Fit Forever: One-A-Day Devotionals for Body, Mind, and Spirit","<p><em>Now when He got into a boat, His disciples followed Him. And suddenly a great tempest arose on the sea, so that the boat was covered with the waves. But He was asleep. </em>Matthew 8:23, 24, NKJV.</p><p>Does it seem to you that more and more is required of you every day? That the demands of work, family, your children's school--not to mention the burgeoning red-tape that business bureaucracies as well as government are piling up--are just too much?</p><p>Sometimes it reminds me of that story about Jesus asleep in the boat in the midst of a storm. Usually when we preachers tell this story, we go to the part where Jesus commands the winds and the waves to \"be still.\" But it seems to me there is an even larger lesson in the simple fact that He was sound asleep in a sinking boat that was taking on water, with the wind howling and the stinging rain all around Him! \"He slept the sleep of the righteous,\" an older deacon once told me after I preached on this topic. Christ had placed Himself in the hands of His Father and He could sleep completely, deeply, and untroubled no matter the commotion and fear all around him.</p><p>The transforming grace of Jesus is just like that. With all of the muddled demands of supervisors (or your staff), requirements of clients and vendors, corporate switchboards with excessive telephone trees and disembodied voice mail, and unexpected emergencies of your children (or your parents)--with all of that, the transforming grace of the Lord Jesus Christ can help you sleep \"the sleep of the righteous.\" There can be peace on the inside if we allow that transforming grace to permeate our heart and mind completely.</p><p>Frankly, I think Jesus would probably tell us that multitasking is a tool of the devil. The Creator did not make human beings to be pushed to the limit, sucked dry of every bit of energy in order for employers to increase productivity. We have a pandemic of degenerative diseases in America that are the direct result of trying to get too much out of life without putting the same investment back in. Everyone wants to win the lottery; everyone wants to get more than they pay for. Very soon Jesus is coming back to tell us, \"Enough is enough!\"</p><p>We can live in the promise of that coming Kingdom of Peace every day, no matter the storms around us, no matter the excessive demands of bosses, corporations, and institutions. </p><p><em>May the peace and the grace of the Lord Jesus Christ be with you today and every day!</em></p><p><DIV ALIGN=RIGHT>--Monte Sahlin</div></p>","126"
