"myMonth","myDay","title","myBook","body","id"
"2","24","In All Thy Ways","The Promises of God","<p><em>Trust in the Lord with all thine heart; and lean not unto thine own understanding. In all thy ways acknowledge him, and he shall direct thy paths</em> (Proverbs 3:5, 6).</p><p>William T. Stead, who went down on the <em>Titanic</em>, was asked to become editor of the <em>Pall Mall Gazette</em> in London. He consulted his friend, Dean Church, about it, and after their interview Mr. Stead expressed his assurance that he would be divinely guided. The dean was astonished at his certainty. \"I should feel swindled,\" said Mr. Stead, \"if I were not so led.\"</p><p>\"Why so?\" asked the dean.</p><p>\"Why? I read in the book of Proverbs: 'In all thy ways acknowledge him, and he shall direct thy paths.' I have acknowledged Him, and I know that I shall be directed.\"</p><p>One of the hardest lessons to learn in this life is to trust God fully. It is so easy, so natural, to lean on our own understanding. \"Be not afraid, only believe\" (Mark 5:36) is the medicine we need. The real test is the Lord's demand for \"<em>all</em> thine heart.\" The same divine requirement is repeated in the last verse of our text: \"In <em>all</em> thy ways acknowledge him.\" If God is not in <em>all</em> our ways, He is not in our ways <em>at all</em>. In little things, as well as the large, we are privileged to acknowledge God. He is interested in us twenty-four hours a day, sixty minutes of the hour, sixty seconds of the minute.</p><p>He watches over all our life's journey, from the first uncertain step of babyhood to the last uncertain step of old age. He knows all about us, gives us all blessings, and leads us all through life if we desire and permit Him to do so. Why then should we not acknowledge Him? \"O Lord, I know that the way of man is not in himself: it is not in man that walketh to direct his steps\" (Jeremiah 10:23). Then let us ask the Lord to direct them. \"A man's heart deviseth his way: but the Lord directeth his steps\" (Proverbs 16:9).</p><p><strong>MEDITATION PRAYER: </strong>\"Hold up my goings in thy paths, that my footsteps slip not\" (Psalm 17:5).</p>","55"
"2","25","Never Wasted","The Promises of God","<p><em>Cast thy bread upon the waters: for thou shalt find it after many days</em> (Ecclesiastes 11:1).</p><p>In 1855 a Bible colporteur went to Toulon, France, and sold copies of the New Testament to the soldiers embarking for the Crimean War. One soldier asked him what the book might be. \"The Word of God,\" he said.</p><p>\"Let me have it,\" was the reply. Then he added with a laugh, \"Now it will do very well to light my pipe.\"</p><p>The colporteur was sorry and thought his efforts wasted. A year later he was working in central France and sought lodging at an inn. The family in charge were in great distress at the death of their son, who had been wounded in the Crimea and had come home to die. \"But we have much consolation,\" said the mother, \"because he was so peaceful and happy.\"</p><p>\"How was that?\" asked the colporteur.</p><p>\"He said he found all his comfort in one little book that he always carried with him.\"
The colporteur asked to see it, and was brought a copy of the New Testament. The last twenty pages had been torn out, but on the inside of the cover were these words: \"Received at Toulon [with the date]; despised, neglected, read, believed, and found salvation.\" The place and date were recognized by the colporteur.</p><p>All your acts, words, and thoughts will return to you sometime, somewhere. The great river of time may seem to carry away all the precious fruit of your hard labor, but do not despair or cease to cast your bread upon the rolling waters. Somewhere it will feed the hungry.</p><p>Put your heart into the Lord's service; give your energy, your enthusiasm, your time, your treasure, your love, to Him. \"Cast thy bread upon the waters.\" God will watch over it, and the day will come when you will find it again on some far shore or near at hand.</p><p><strong>MEDITATION PRAYER: </strong>\"Let my cry come near before thee, O Lord: give me understanding according to thy word\" (Psalm 119:169).</p>","56"
"2","26","Never Ashamed","The Promises of God","<p><em>For I am not ashamed of the gospel of Christ: for it is the power of God unto salvation to every one that believeth; to the Jew first, and also to the Greek. For therein is the righteousness of God revealed from faith to faith: as it is written, The just shall live by faith</em>(Romans 1:16, 17).</p><p>A little church in a mining town of Bolivia was being dedicated. It was constructed of such material as the people had in hand. The floor and some of the furniture were made of shipping boxes for explosives used in the mines. When the preacher stepped behind the pulpit, he saw the words <em>Explosivos peligrosos</em> (\"Dangerous explosives\").</p><p>The gospel is \"the power of God unto salvation.\" The apostle Paul here uses the word for \"power\" from which our word \"dynamite\" is derived. The true gospel is the mighty power of God unto salvation to everyone who believes, and the apostle was not ashamed of it, because he experienced its power in his own life and saw its transforming action in others.</p><p>The pagan world, with all its culture and degradation, could not resist the gospel. Hatred, persecution, ridicule, argument--nothing could destroy it. The gospel alone could meet the need of the sinful human heart. It was built on man's weakness and God's power. It was, and is, the answer to earth's great problem--how to find righteousness. \"For therein is the righteousness of God revealed . . . , The just shall live by faith.\" To be just is to be righteous, and this is no human attainment. \"Not by works of righteousness which we have done, but according to his mercy he saved us\" (Titus 3:5).</p><p>Righteousness is always and only and forever by faith (Romans 10:10). It is imputed to us (Romans 4:22). It is imparted to us (Philippians 3:9). It is the righteousness demanded by the law of God, but not given by it. It bears the fruit of obedience (Romans 8:3, 4; cf. James 2:17, 18). O friend, you will never be ashamed of the gospel of Christ if you accept it as God's power for your life.</p><p><strong>MEDITATION PRAYER: </strong>\"For thou. Lord, wilt bless the righteous; with favour wilt thou compass him as with a shield\" (Psalm 5:12).</p>","57"
"2","27","The Refuge of Faith","The Promises of God","<p><em>I know that, whatsoever God doeth, it shall be for ever: nothing can be put to it, nor any thing taken from it: and God doeth it, that men should fear before him. (Ecclesiastes 3:14)</em></p><p>Every confession of faith must begin, as does the famous Apostles' Creed, with the pronoun \"I.\" Real faith is a personal experience. \"Live by faith until you have faith,\" Peter Boehler admonished John Wesley.</p>
<blockquote>Nothing before, nothing behind;<br />The steps of Faith<br />Fall on the seeming void, and find<br />The Rock beneath.</blockquote><div align=\"RIGHT\">--WHITTIER</div>
<p>Millions of people today are spiritually adrift. They have no sure haven for their souls. They have no solid anchor of truth, no clear conviction of right and wrong, of yes and no, of white and black; only a hopeless gray of indecision. It is not always popular to be positive.</p><p>The unhappiness of modern man comes directly from his lack of faith. Every one of us needs a refuge from the storms of life, and that refuge is faith in God. For peace of soul we must be able to say, A\"I know.\" The writer of today's text <em>knew</em> something. He knew that what God does He does for eternity. The things that God is doing now will reach fulfillment despite opposing forces. When we see God at work in the world, we should take courage and \"fear before him.\" We are too greatly influenced by the spirit of the age, by time. Man's ideas, ways, doings, are as changeable as the weather, but through daily study of God's Word and prayer we may keep in step with the Eternal on His march through the ages.</p>
<blockquote>Changeless in a world of change,<br />Thy Word reveals the way,<br />Shining all along the path<br />From darkness unto day.</blockquote><p><strong>MEDITATION PRAYER: </strong>\"In the Lord put I my trust\" (Psalm 11:1).</p>","58"
"2","28","Fear: Satan's Weapon","The Promises of God","<p><em>Be not afraid of their faces: for I am with thee to deliver thee, saith the Lord</em> (Jeremiah 1:8).</p><p>The visitor to Westminster Abbey sees many memorials to great men, but there is no nobler tribute than that inscribed on the monument to Lord Lawrence--simply his name, the date of his death, and these words: \"He feared man so little because he feared God so much.\"</p><p>Be afraid to be afraid! Conceit and pride are to be dreaded, but so is cowardice. Severe punishment is given to soldiers guilty of \"cowardice in the face of the enemy.\" Fear is one of Satan's chief weapons, and when it enters the heart we are in danger of falling into sin. The apostle Peter was overcome with fear and denied that he had ever known his Lord (Matthew 26:69-75).</p><p>Do they threaten you? Then it is time for boldness. \"And now, Lord, behold their threatenings: and grant unto thy servants, that with all boldness they may speak thy word\" (Acts 4:29).</p><p>Should we ever \"be afraid of a man that shall die\" (Isaiah 51:12)? Are you afraid of losing your position? God will never suffer His servants to \"want any good thing\" (Psalm 34:10).</p><p>Do they ridicule you? Scorn and ridicule never killed God's servants of old (Job 16:20). Remember, Daniel stood alone in the lions' den when it would have been easier to go along with the crowd. The three young men on the plains of Dura stood for a conviction when it meant discord with the public orchestra.</p><p>So, let us fear to fear. God said to Jeremiah, \"Be not dismayed at their faces, lest I confound thee before them\" (Jeremiah 1:17).</p><p>And what reason we have for bravery! \"I am with thee to deliver thee, saith the Lord.\" So, let us fall on our knees and cry for help. Then, armed with this promise, we can rise up saying, \"I will fear no evil: for thou art with me\" (Psalm 23:4).</p><p><strong>MEDITATION PRAYER: </strong>\"O Lord my God, in thee do I put my trust: save me from all them that persecute me, and deliver me\" (Psalm 7:1).</p>","59"
"3","1","On Solid Ground","On Solid Ground","<p><em>Therefore whoever hears these sayings of Mine, and does them, I will liken him to a wise man who built his house on the rock: and the rain descended, the floods came, and the winds blew and beat on that house; and it did not fall, for it was founded on the rock.</em> Matthew 7:24, 25.</p><p>On July 28, 1976 the worst earthquake of the twentieth century, in terms of loss of life, killed 240,000 people in Tangshan, China. Most were villagers who lived in poorly constructed homes with weak foundations. This is also true of the massive earthquake in Gansu, China, which registered an amazing 8.6 on the Richter scale and took 200,000 lives on December 16, 1920. The pattern is the same everywhere in the world. Whether it is Northern Peru, Central America, or southern Turkey, if the quality of the building is poor, the devastation is the greatest. Weak buildings do not survive earthquakes.</p><p>The same principle is true in our own spiritual lives. Some people do quite well when life goes well. They seem to thrive in life's good times, but when storms of difficulty crash on them, they fall apart. Why? Their spiritual experience is built on the weak foundation of their own human abilities. As long as their problems are no greater than their ability to cope, they do fine. When their problems grow larger than their inner strength, they crumble. Without a solid foundation they cannot cope with the seismic shocks of life.</p><p>God provides a solid foundation in His Word. As we meditate upon the truths of Scripture, we grow into mature Christians. God's Word gives our faith a strength and stability. It enables us to stand when the storms of life are fierce. It supports us when everything around is crumbling. Ellen White puts it this way: \"Our bodies are built up from what we eat and drink; and as in the natural economy, so in the spiritual economy: it is what we meditate upon that will give tone and strength to our spiritual nature\" (<em>Steps to Christ</em>, p. 88).</p><p>Fill your mind with God's Word. Open your heart to the influence of His Spirit through the Word. If you do, you will develop a solid, rock-hard faith that will meet the test of any storm.</p>","60"
"3","2","Precious Promises","On Solid Ground","<p><em>By which have been given to us exceedingly great and precious promises, that through these you may be partakers of the divine nature, having escaped the corruption that is in the world through lust.</em> 2 Peter 1:4.</p><p>Millions around the world testify to the changes in their lives as a result of Bible study. The Bible's appeal is universal. It speaks to the hearts of men and women of all ethnic groups, all cultures, and all ages.</p><p>Reading its pages, drunkards become sober, thieves become honest, prostitutes become pure, and drug addicts become clean. Anger, bitterness, and resentment yield to loving forgiveness, mercy, and tolerance. Selfish greed gives way to unselfish service. Crumbling marriages are renewed. Broken relationships are rekindled. Shattered self-esteem is restored. In God's Word, the weak find strength, the guilty find forgiveness, the discouraged find new joy, and the despairing find hope. The same Holy Spirit who inspired the Bible's writers inspires those who read it.</p><p>In the early 1960s Tex Watson traveled to southern California in search of what he called Atotal freedom.\" He began hanging around an abandoned movie ranch with members of Charles Manson's \"family.\" Tex proved an outstanding pupil, absorbing large quantities of drugs and imbibing the Manson philosophy of life. Manson told his followers they must be free, like wild animals, to live, lie, and kill.</p><p>What followed was the Tate-La Bianca killings in the summer of 1969. The calculated, grisly murders of seven people shocked the nation. Tex was convicted as one of the murderers. Psychiatrists diagnosed him as Ainsane, totally incapable of standing trial.\" While in the Los Angeles County Jail, he would throw himself screaming against the bars.</p><p>Today, all of that has changed. Tex Watson is a new man. He resides at a medium- security prison in San Luis Obispo, California, leading Bible studies and sensitively answering the questions of the inmates. Watson heads an organization called Abounding Love Ministries. This is no superficial jailhouse conversion. Tex has held \"model prisoner\" status for 15 years. The Holy Spirit, working through Scripture, has transformed his life. As Watson studied, meditated, and applied God's Word to his life, he changed.</p><p>If God did it for him, He can do it for us, as well. When the precious promises of God's Word become precious to us, they change us deep down inside. Discover this life-changing power for yourself.</p>","61"
"3","3","The Second Touch","On Solid Ground","<p><em>Then He put His hands on his eyes again and made him look up. And he was restored and saw everyone clearly. </em>Mark 8:25.</p><p>Which statement below most accurately reflects your feelings?</p><p>\"Bible study is the most exciting portion of my day. I look forward to it as much as anything else I do.\"</p><p>Or:</p><p>\"Bible study is rather boring, uninteresting, and certainly not exciting. I sort of force myself to do it because I know I should, but I don't enthusiastically anticipate it.\"</p><p>Sometimes we need the second touch. Today's Bible verse tells of the blind man whose eyes Jesus touched twice before his vision became crystal-clear. We too may need to see with new eyes. Here are two powerful Bible study techniques that will help you discover new gems of truth in God's Word. Applying these two simple principles will transform your attitude toward your Bible study time. The \"eyes\" of exciting Bible study are visualization and identification.</p><p>As you read the stories of the Bible, attempt to picture each scene in the narrative. Visualize the man stricken with palsy, shaking from head to toe as Jesus approaches. Picture the crowded marketplace in Jerusalem. Look through Jesus' eyes at the hungry multitude seated on the grassy slopes near the sea of Galilee. Rather than hurrying through a passage to get to the point, pause for a moment to observe these important scenes. As you visualize each scene, picture it in your mind, and try to identify with the Bible characters in the scene.</p><p>Imagine that you are the woman caught in adultery. Imagine that you are the thief on the cross. Imagine that you are the Roman centurion crucifying Christ. Get inside these characters. What would you feel if you were in their place? What would you be thinking if you were experiencing what they were going through? What if you were Daniel, unjustly condemned and thrown into the lions' den? How would you have felt if you were Moses, placing your feet in the Red Sea as it parted? Analyze the thoughts and feelings of the Bible characters. Put yourself in their places. Weep as they weep. Rejoice when they rejoice. Let your spirits soar with their triumphs and crash with their defeats. Seeing through new eyes will transform Bible study into an exciting adventure in faith.</p>","62"
"3","4","The Living Word","On Solid Ground","<p><em>For the word of God is living and powerful, and sharper than any two-edged sword, piercing even to the division of soul and spirit, and of joints and marrow, and is a discerner of the thoughts and intents of the heart. </em>Hebrews 4:12.</p><p>Helen Keller grew up in a world shut in by blindness and deafness. She became an almost uncontrollable Awild child\" of intense passions.
One day while Helen was playing with a new doll her patient tutor, Anne Sullivan, placed the toy in Helen's lap and signed the letters d-o-l-l in her palm repeatedly. But Helen didn't understand. As the tutor tried to help her connect this thing in her lap with the signs on her palm the girl became agitated. She slammed the doll on the floor, breaking it to pieces.</p><p>Later Miss Sullivan took the unruly girl down the path to the well house. Someone was pumping water. Placing Helen's hand under the cool flow, the tutor spelled out w-a-t-e-r on her other palm. Suddenly it clicked in the girl's mind. Later, Helen recalled, \"The mystery of language was revealed to me. I knew then 'w-a-t-e-r meant the wonderful cool something that was flowing over my hand. That living word awakened my soul, gave it light, hope, joy, set it free!\"</p><p>The soul of this wild child, shut away in her own darkened world, was set free by the discovery of the living word. God's living Word, the Bible, illumines the darkness of our minds and sets us free as well. You can experience the exhilarating freedom that the living Word brings. Take a few verses at a time. Ask yourself these questions regarding the passage you are contemplating: What is God personally saying to me in this portion of Scripture? What does this passage teach me about the character of God? Is there anything in this passage that speaks to my own spiritual life?</p><p>Psalms is a great place to begin such reflections. Take one psalm at a time. Read a few verses. Allow the Holy Spirit to impress your mind. Pause, respond to God in prayer by communicating to Him regarding what He is saying to you in Scripture. Your prayer may take the form of praise, thanksgiving, requests, petitions, confession, repentance or intercession. As you allow the living Word to shape your thoughts you will be set free to know God in a close, intimate way. Today, allow that living Word to truly set you free.</p>","63"
"3","5","Amazing Accuracy","On Solid Ground","<p><em>The words of the Lord are pure words, like silver tried in a furnace of earth, purified seven times. You shall keep them, O Lord, You shall preserve them from this generation forever.</em> Psalm 12:6, 7.</p><p>What concrete evidence do we have that the Bible is historically accurate? Is there reliable information regarding names, places and geographical locations in Scripture? Discoveries in the past 200 years demonstrate the validity of God's Word. Archaeology does not prove the Bible is divinely inspired, but it does provide a basis for belief. Demonstrating the accuracy of scores of biblical details, it supports our faith. The past two centuries have provided us with a number of remarkable archaeological finds. Here are just a few.</p><p>The Moabite Stone, discovered in 1868 in Jordan, confirms the Moabite attacks on Israel as recorded in 2 Kings 1 and 3. This is hard evidence from outside the Bible of a specific event recorded by writers of Scripture. Following the death of Israel's king Ahab in 853 B.C., the king of Moab attacked Jehoshaphat, king of Judah. Through the miraculous intervention of God the Israelites Arose up and attacked the Moabites, so that they fled before them . . .\" 2 Kings 3:24 The Moabite Stone precisely records the Moabite defeat and their subsequent retreat as outlined in the Bible.</p><p>One of the most amazing finds of the twentieth century was the \"Lachish Letters,\" discovered from 1932 to 1938. These incredible documents found 24 miles north of Beersheba describe the attack of Nebuchadnezzar on Jerusalem in 586 B.C. They detail Jerusalem's fall from the perspective of Babylon. The Lachish Letters confirm the historical accuracy of Jerusalem's fall. They testify to the truthfulness of the inspired prophets in Chronicles, Isaiah, and Jeremiah, who spoke of Babylon's attack on Jerusalem.</p><p>Another almost unbelievable find is the Cyrus Cylinder, made of clay. This record describes Cyrus, the Persian king, including his overthrow of Babylon and the deliverance of the Jewish captives in 539 B.C. This archaeological find is especially significant when one considers that Cyrus was named more than 150 years before his birth, in Isaiah 44:27,28 and Isaiah 45:1 as God's chosen Ashepherd\" who would carry out the deliverance of Israel.</p><p>These discoveries, along with scores of others, continue to confirm the accuracy and reliability of the Bible. They speak eloquently of a God who has not left Himself without a witness in the world. They testify powerfully that we can have absolute confidence in the integrity of the Scriptures. Praise God that His Word still stands.</p>","64"
"3","6","Passing the Test of Time","On Solid Ground","<p><em>The grass withers, the flower fades, but the word of our God stands forever. </em>Isaiah 40:8.</p><p>The word of God has stood the test through the centuries. It has proved trustworthy over time. Archaeological finds and discoveries of ancient manuscripts through the years have shed light on the authenticity of the Bible.</p><p>In 1798 Napoleon led 38,000 of his troops into Egypt. He also took hundreds of artists, linguists, and scholars to help him better understand the history of that intriguing land. Relics of the past were everywhere, with their hidden mysteries of a once-great civilization. Strange inscriptions decorated monuments and temple walls, leaving Napoleon and his brain trust wondering what secret messages they contained.</p><p>In 1799 one of Napoleon's soldiers unearthed a black stone about four feet long and about two and a half feet wide that would unlock the mystery of Egyptian picture writing and reveal secrets hidden for centuries. That slab, known as the Rosetta Stone, is now housed in the British Museum in London, England. The Rosetta Stone bears an ancient decree in three different languages: hieroglyphics (Egyptian picture writing), cursive Egyptian, and Greek. Scholars quickly translated the Greek text, but puzzled over the hieroglyphics. Twenty years later, in 1822, a brilliant young French Egyptologist by the name of Jean Francois Chapollion startled the world by cracking the ancient code. With the language unveiled, scholars were able to verify biblical passages that had appeared questionable. Here is one striking example.</p><p>The Bible mentions a people called the Hittites about fifty times, discussing their dealings with Abraham, David, and Solomon. These biblical references picture the Hittites as one of the most powerful of ancient empires. Yet in all of the ancient historical records not a trace of them remained. Critics reasoned that it would be impossible for such a mighty empire to disappear from history without leaving a trace behind. They suggested that such a nation never existed. But then came the Rosetta Stone. The vast museum of monuments and pillars all along the Nile, its messages locked up in hidden languages for centuries, now opened their doors. Inscriptions on these pillars and palace walls speak repeatedly of the political and military conflicts between Pharoah Rames II and the \"King of Hitti,\" or the Hittites. Today the Hittites' place in history is well established.</p><p>
The Bible's claims are reliable. We can safely trust God's Word to reveal guidance, directions, instruction, faith, and hope for the future. In the shifting moral values of the twenty-first century world, God's Word is still trustworthy.</p>","65"
