"myMonth","myDay","title","myBook","body","id"
"3","26","God Empowers Our Choices","On Solid Ground","<p><em>And if it seems evil to you to serve the Lord, choose for yourselves this day whom you will serve. . . But as for me and my house we will serve the Lord. </em>Joshua 24:15.</p><p>My friend Bill's father struggled with tobacco. Early in the morning Bill would see his dad pacing in front of the family farmhouse, fighting a terrible craving to chew tobacco. Often the old man took his chewing tobacco in his hand and threw it far out into the cornfield. Now he was free. He was done chewing tobacco.</p><p>But, as Bill tells the story, along about noon he would see his dad out among the cornstalks, head bent low, looking for something. What was he searching for? The tobacco he had thrown out in the morning!</p><p>Here's my question. If you were God, would you let him find it? \"Oh no!\" somebody says. \"God would not let him find it!\" But God did. Why? Because He gave Bill's dad the same power of choice in the afternoon that He did in the morning. God does not manipulate the will. God allows us to make choices. When we choose to put our will on the side of right, the Holy Spirit empowers our choices.</p><p>We do not overcome Satan's temptations through our willpower. We overcome them through God's power. Here is an often neglected, greatly misunderstood truth. We cannot overcome sin in our lives without God. And God will not overcome sin in our lives without us. In the plan of salvation our cooperation with God is imperative. As the Holy Spirit impresses our minds, we choose to surrender that specific sin that is offensive to God. Then the Holy Spirit gives us the strength to overcome. We do not overcome sin through our determined choice. Jesus made it plain when He said, \"For without Me you can do nothing\" (John 15:5).</p><p>Let's suppose I am in a large auditorium. The room is totally dark. It's impossible to find the exit. What if I had a shovel? How long would it take to shovel the darkness out? How much effort would it take to shovel all the darkness out? What if 100 people worked for three hours--could we push it out together? What if you guided my hand to a light switch on the wall? What if you helped me throw the switch? Immediately the room would fill with light. Why? The action of my finger, however small, threw the switch and connected the electrical wires with the source of power. When we place our will on the side of right, we connect with a source of infinite power. God's power flows into our lives. Dramatic, miraculous change occurs.</p><p>Christ longs to fill your life with His power. He longs to empower your choices. He will do it today. Why not yield to the impression of His Spirit now? </p>","85"
"3","27","Priceless Treasure","On Solid Ground","<p><em>Again, the kingdom of heaven is like treasure hidden in a field, which a man found and hid; and for joy over it he goes and sells all that he has and buys that field.</em> Matthew 13:44.</p><p>Colorado has a rich history of silver and gold mining. One of the most successful Colorado mining operators in the days of the early West was a man named Horace Tabor. He made millions from a site near Cripple Creek that he named Matchless Mine.</p><p>His wealth went to his head, and he began to do as he pleased. Tabor divorced his wife and married a beautiful socialite named Baby Doe. Soon misfortune overtook them. The price of gold and silver plummeted. Tabor incurred enormous debts. In the end he died a brokenhearted, poor man. But before his death he supposedly gave Baby Doe this admonition: \"Have faith in the Matchless Mine; never give it up. It will give you back all that I have lost.\"</p><p>Despite this, the Matchless was soon lost to foreclosure; but for whatever reason, Baby Doe decided to live in a dilapidated storage shack near it, and continued there (at the generosity of the mine's new owners) until her death in 1935. The Matchless proved to have played out; if Baby Doe was hoping against hope that it would yet yield riches, her hopes were never realized.</p><p>One mine will never play out. There is one source of wealth that produces more and more. There is a mine of truth that is endless. The riches of His grace can never be exhausted. Jesus is the treasure hidden in the field. In comparison to all we have, our Savior is more precious still.</p><p>Someone has defined sacrifice as giving up something of lesser value for something of greater value. For example, when a person gives up smoking, they give up something of lesser value, cigarettes, which contribute to cancer and heart disease, for something of higher value, good health. Jesus' love is of inestimable value. His grace is incomparable. Receiving Jesus, we receive peace and pardon and power and purpose. Think of it. In Christ we receive an inner peace as He enters our life. He gives us a sense of calm security. He delivers us from the guilt of our past failures. He silences the accusing voices of a condemning conscience. In Christ we receive power. He imparts supernatural power to live. He is stronger than the habits that bind us. </p><p>The power of grace is greater than the power of sin. In Christ we have a new purpose for living. Christ gives us a new direction for our lives. He gives to life a new sense of meaning. There is no greater treasure. There is nothing of any greater value. There is nothing more precious. Christ is a mine that will never ever run out.</p>","86"
"3","28","Paul's Three Nots","On Solid Ground","<p><em>Not that we are sufficient of ourselves, . . . but our sufficiency is from God.</em> 2 Corinthians 3:5.</p><p><em>Therefore we do not lose heart. . . . The inward man is being renewed day by day.</em> 2 Corinthians 4:16.</p><p><em>We do not look at the things which are seen, but at the things which are not seen. </em>2 Corinthians 4:18.</p><p>The apostle Paul was absorbed with Christ. In these passages he eloquently proclaims three \"nots.\" In the first \"not,\" the apostle declares that \"We are not sufficient.\"</p><p>The word \"sufficient,\" as defined by <em>Webster's New American Dictionary</em>, means \"adequate to accomplish a purpose or meet a need.\" It can also be defined as \"capable of\" or \"able to do.\" Christ is the only one who can meet our deepest needs. Any attempt to meet the inmost needs of the soul outside of Christ is destined for bitter failure. Pleasure cannot satisfy our soul hunger. Popularity can't do it. Prestige can't accomplish it. Power won't meet the heart's needs. Only Jesus can truly satisfy. He is our sufficiency. Neither are we sufficient to save ourselves or fight the battle with our adversary alone. As the apostle states, \"Our sufficiency is from God\" (2 Corinthians 3:5). Christ is our sufficiency. He is also our source of confidence.</p><p>In Paul's second \"not,\" he exclaims that we do not lose heart. Our outward person may perish. Sickness may afflict us. Disease may ravage our frame. Old age may take its toll. Heart disease, cancer, or diabetes may devastate our body. In spite of what happens to us, Christ is working within us. He is our courage. He is our confidence. He is our comforter. He gives us hope for a brighter tomorrow. We do not lose heart. Christ lifts our spirits.</p><p>The apostle now comes to his final and third \"not.\" \"We do not look at the things which are seen.\" Christ is our vision. He lifts our sight from what is around us to what is above us. He lifts our vision from what is to what will be. He lifts our eyes from the things of time to the things of eternity.</p><p>During the London bombings of World War II, enemy planes pounded the city night after night. Fires blazed as whole neighborhoods turned into rubble. One little boy, peering out from a shelter, kept staring at the explosions in the distance. He stood there shaking and crying. But his father came quickly and turned his boy around and said firmly, \"Face toward me. Face toward me.\"</p><p>The rest of the night, while bombs streamed down, the little boy would turn his face toward his father and stop shaking; the terror would drain from his face.</p><p>Today and each day Jesus appeals to us: \"Face toward Me. Fix your eyes upon Me. Look at Me. I am your sufficiency. I am your confidence. I am your vision. Rest in My arms. Be secure in My love. Be hopeful in My embrace.\"</p>","87"
"3","29","I Am Persuaded","On Solid Ground","<p><em>For I am persuaded that neither death nor life, nor angels nor principalities nor powers, nor things present nor things to come, nor height nor depth, not any other created thing, shall be able to separate us from the love of God which is in Christ Jesus our Lord. </em>Romans 8:38, 39.</p><p>In 1556 a young man named Claes experienced a dramatic conversion. Studying Scripture in his Belgian home, he was overwhelmed with God's love. He concluded that salvation was through faith in Christ alone. Christ filled his heart and radiated from his countenance, and he just could not keep silent. The Christ whom he so passionately loved led him to share that love with others.</p><p>Church and state were united in sixteenth-century Europe, and the state church did not tolerate the slightest dissent. Claes was arrested and brought to Ghent because he challenged the church's view on salvation. The authorities tried to talk him out of his beliefs before burning him alive. He knew the only way he could avoid the stake was to give up those beliefs. But he held fast. Claes wasn't intimidated by the power of the state looming over him. He couldn't be coerced. </p><p>Claes was asked, \"What is your faith?\" He replied, \"I believe only in Christ Jesus, that He is the living and true Son of God, and that there is no other salvation, whither in heaven or on earth.\" Claes kept his eyes on the Lamb of God, who had shed His blood for him. That was his security and strength. That was his purpose. He took great comfort in the promise Jesus made in Matthew: \"Lo, I am with you alway, even unto the end of the world\" (Matthew 28:20, KJV).</p><p>Jesus came through in Claes's darkest hour. And Claes could have joy in the Lord his God. In the last moments of his life, just before his execution, our Lord gave him an unusual peace. Claes wrote, \"My heart kindled within me with joy to the Lord my God, so that all my trouble and anxiety were driven from me as dust is swept from the street.\"</p><p>Claes went to his death secure in Jesus' love. He was at perfect peace.</p><p>All the demons in hell cannot separate us from God's love. Sickness cannot do it. Tragedy can't accomplish it. Misfortune and mistakes are not powerful enough to separate us from God's love. Divorce, disease, discouragement, disaster, and death itself are not strong enough to separate us from God's love. In our darkest moments God's love is still there. Like Claes, you too can exclaim, \"Lord, Thou art faithful to Thy promise.\"</p>","88"
"3","30","Triumph In Christ","On Solid Ground","<p><em>Now thanks be to God who always leads us in triumph in Christ, and through us diffuses the fragrance of his knowledge in every place. </em>2 Corinthians 2:14.</p><p>Her name was Soetgen. She was arrested for her faith in 1559 and separated from her family, including her husband, Claes. When authorities executed Claes, Soetgen tasted fear and loneliness. From her prison cell in Ghent, Belgium, she looked out at life going by and knew she would never be a part of it again. She sensed that she would never again see her children. With tears in her eyes she wrote a letter of calm assurance and encouragement to them. This letter has been preserved down through the centuries, and it calls us to faithfulness today.</p><p>She wrote, \"Since it pleases the Lord to take me out of this world, I will leave you a memorial, not of silver or of gold, for such jewels are perishable, but I should like to write a jewel into your heart, if it were possible, which is the word of truth.\"</p><p>In her final hours Soetgen did not think of her suffering and imminent death. She longed for her children to be faithful to the Christ she loved. She longed for them to experience His grace, to be faithful to His truth. Her letter continues with these powerful words: AI commend you to the Lord. . . . May He keep you to the end of your lives. May He lead you to the New Jerusalem, that we may see each other with joy on the day of the resurrection.\"</p><p>Helpless could have overwhelmed Soetgen. She could have just fallen apart. Instead she wrote a letter full of love and confidence.</p><p>Just before her death, Soetgen received an encouraging letter from her daughter, Betgen. Yes, her precious little girl still clung to Christ. Yes, the same faith still burned in her heart. Yes, the same love for Christ still filled her life.</p><p>On November 27, 1560, Soetgen burned as a so-called heretic. Her parting words to her children, hastily written with a trembling hand, were \"Herewith I commend you to the Lord, and to the work of His grace.\"</p><p>There is nothing more precious than our relationship with Christ. There is no other relationship more important. To know Him is life's most important priority. Echoing and reechoing over the centuries from a damp Belgian cell, the witness of a faithful martyr's life urges us to Aseek first the kingdom of God and His righteousness\" (Matthew 6:33).</p>","89"
"3","31","Heartily Unto the Lord","On Solid Ground","<p><em>And whatever you do, do it heartily, as to the Lord and not to men.</em> Colossians 3:23.</p><p>Pieter Beckjen made his living by ferrying people and goods on the river Amstel. Sometimes he would sail down the canals of Amsterdam with fellow believers--so they could worship in secret.</p><p>When Pieter and his wife had their first child, the couple tried to keep the infant hidden so they wouldn't be forced to have it christened in the state church. But neighbors eventually betrayed them to the magistrates.</p><p>Pieter was tried, convicted for Acrimes against the divine and secular majesty . . . which disturb the peace,\" and condemned Ato be executed with fire . . . and his entire property confiscated.\"</p><p>They put this earnest ferry operator on the rack in one last fiendish effort to bend his faith. But it proved unshakable. Pieter was burned in January of 1569.</p><p>A close friend of his, Willem Janss, heard about the planned execution and hurried to the site from a nearby town. Wanting to offer some encouragement, he arrived at Amsterdam's gate, but the bar had already been let down. Willem had to bribe the gatekeeper to let him in.</p><p>He rushed to the site of the execution and arrived just as Pieter was being led out to the stake. Willem called out, \"Contend valiantly, dear brother.\"</p><p>What gave Pieter such death-defying faith? Why was he willing to stand \"heartily\" for the Lord without wavering? There is one significant reason. He believed that Jesus was more than a good man. He believed that Jesus was divine and that His offer of eternal life was real. To reject Jesus was to reject eternal life. Pieter accepted the Savior's words to Martha: \"I am the resurrection and the life. He who believes in Me, though he may die, he shall live. And whoever lives and believes in Me shall never die\" (John 11:25, 26). Eternal life is life forever in the joyful presence of God the Father, Jesus Christ His Son, the Holy Spirit and all the heavenly hosts.</p><p>The martyrs of the past saw beyond the flames to eternity. By faith they grasped the promises of God.</p><p>The promise is ours today: \"He who believes in Me shall never die\" (John 11:25, 26). Our lives are \"hidden with Christ in God\" (Colossians 3:3). His promise of the resurrection is certain. We can have absolute confidence that He will fulfill His word.</p>","90"
"4","1","The Future Is in God's Hands","A Word From Home","<p><em>\"For I know the plans I have for you,\" declares the Lord, \"plans to prosper you and not to harm you, plans to give you hope and a future.\"</em> Jeremiah 29:11, NIV.</p><p> New Year's Day dawned bright and beautiful, but I was feeling sad--in fact, depressed. \"Please help me, God!\" I cried. </p><p><em>I hate to feel this way, I thought, but I do.</em></p><p>I knew I needed to do something, so I opened my cupboard to look for something to do. A printed page fell from the top of the cupboard as if it were a message from heaven. It was titled, \"The Comfort of His Presence.\" I was amazed as I picked it up and read, \"If at the moment you feel so deep 'in the valley' that life is a misery and holds little meaning, in simple faith place your hand into the hand of God, reaffirm your faith in Him who cares for you, and even in your depression you will realize the abiding presence of God. Before facing any problem you will find it most helpful to concentrate your mind upon one of the Gospel stories where Jesus deals with a specific human problem. Capture the spirit of the story, then, in the spirit, turn to your own problem. You will find that God and you are looking at the problem together, and when this happens, the solution is not far away\"--Anonymous.</p><p> Someone has said that \"Advice is like castor oil: Easy to give to others but difficult to take yourself.\" Yes, it's easy to give others advice, but when our bag of problems seems too heavy, we still try to carry it ourselves.</p><p>I'm so glad God is always there. He never changes. He is the One and only constant in life, and the only One in whom we can place our reliance to see us through when days are dark.</p><p>As you live one day at a time throughout this New Year, put your trust in God, who is the same yesterday, today, and forever. </p><p>I felt like a blind person groping in the dark, but with Jesus at my side I knew I could make it; He knows the way. Let Him be your constant companion. He knows what is best for us. He will comfort and protect us and give us hope.</p>
<blockquote>Days of darkness still may meet me, sorrow's path I oft may tread;<br />But His presence still is with me, by His guiding hand I'm led</blockquote><div align=\"RIGHT\">--Anonymous</div><DIV ALIGN=RIGHT>--Priscilla Adonis</div></p>","91"
"4","2","The Challenge for Today","A Word From Home","<p><em>So I commend the enjoyment of life, because nothing is better for a [woman] under the sun than to eat and drink and be glad. Then joy will accompany [her] in [her] work all the days of the life God has given [her] under the sun.</em> Ecclesiastes 8:15, NIV.</p><p>A psychologist once surveyed some 3,000 people picked at random from a telephone directory. The survey was brief. It asked, \"What have you got to live for?\" More than 90 percent of the respondents stated they were waiting--waiting for their marriage to improve, for their children to grow up, to become grandparents. They were waiting to retire and gain more leisure time. They were waiting for next year, or a dreamed-about tour of Europe. They were waiting for something exciting to happen. They were giving up today for the promise tomorrow held. These people failed to realize that today is the tomorrow they waited for yesterday!</p><p>It's a pity to endure the present while waiting for some future event that may, or may not, happen. Today you have been given a fresh beginning. Today you can open your eyes and find a new world. This world is yours. Enjoy every moment of it today because it will soon be gone. Thank God for the new beginning you can enjoy today!</p><p>Greet today with a smile. Breathe in the fresh, cool air and revel in the rays of sunshine. Beauty is God's therapy for the ugly side of life. Fear, anxiety, depression, and worry can be overcome with an appreciation of beauty.</p><p>Today is here. Don't think of what you would do if only things were different. Things are not different. They are what they are. Make the best of what you have.</p><p>Dream, if you will, but work to make your dream come true. Stop saying, \"If only I had the time, I'd--\" You'll never find time to do everything. Pick one thing you want to do, and do it.</p><p>Today act toward God and others as if it were your last day on earth. Life begins when you take charge of your attitude and begin enjoying what you have. Today determines your quality of life tomorrow. If you want freedom and happiness, you must fight for it now.</p><p>Today is the time to make the hard choices necessary to accomplish this. The greatest gift you can give the people you love--is you. Now is the time to develop high-quality relationships. If you accomplish this you will be a happier person and touch lives around you in a positive way.</p><p><DIV ALIGN=RIGHT>--Nancy Van Pelt</div></p>","92"
"4","3","A Lesson in the Face of a New Life","A Word From Home","<p><em>If ye . . . . being evil, know how to give good gifts unto your children, how much more shall your Father which is in heaven give good things to them that ask him? </em>Matthew 7:11.</p><p>Wayne and I were blessed to see brand-new Ayiana Ayala last weekend. She is absolutely perfect! Ayiana resembles her mother, Natalie, and has her cute nose. She is a pink little thing, with coal-black hair that has a bit of wave in it.</p><p>I sat and watched Ayiana after the nurse came in the room to weigh her and check her temperature. Standard procedure. After she dressed her in a fresh gown and diaper, carefully swaddled and returned her to the tall bassinet, Ayiana finally opened her eyes. I stared as she seemed to be familiarizing herself with the world around. They say that newborn infants can't visually focus right away, but it looked as if she was trying out those strangely blue/brown/black eyes in earnest. Her pretty pink mouth opened as wide as she could get it, obviously searching for her mommy's breast. It was too, too cute. I didn't want to take my eyes off that precious face.</p><p>Later, I thought about the differences between a human baby and a newborn in almost any part of the animal kingdom. By the end of the day of its birth, a new giraffe has already learned to stand up. The baby bald eagle will eat its meaty meal with ease on that first day. But Ayiana will not stand up unassisted until she's somewhere between 6 and 9 months. She may enjoy her first unstrained or unmashed meal within that same period. Simply, Ayiana needs her mother, not just to survive but to get from place to place, to make decisions for her, and to provide security.</p><p>Watching our little goddaughter reminded me of how dependent I am on my heavenly Papa for survival--not just physically, but spiritually. I am as pitiful and as needy as a newborn babe when I set out to make it on my own. I am not equipped. I need a tender, loving, and doting Daddy.</p><p>How blessed we are to live in a world created by an awesome, eternal God who wants so much to be our Abba-Father as well. Such love, such condescension!</p><p><em>Thank You, Papa-God, for creating me, then adopting me, and providing everything I need to survive. I long to see You and to put my head on Your shoulder--forever.</em></p><p><DIV ALIGN=RIGHT>--Renee Verrett-Dooley</div></p>","93"
"4","4","A Higher Standard","A Word From Home","<p><em>Do not be conformed to this world, but be transformed by the renewing of your mind, so that you may prove what the will of God is, that which is good and acceptable and perfect.</em> Romans 12:2, NASB.</p><p>My husband doesn't call me a gypsy for nothing; I love to travel, and I've gotten around to some places I never dreamed I would go. Recently I returned from a trip to Seoul, South Korea. It was truly a different world from the United States in more than one way, but there was one thing that stood out above all the rest--the people.</p><p>My flight over stopped in Tokyo before going on to Shanghai, so there were mostly Asian passengers on board. I was really impressed with how quiet and calm everyone was for 13 long hours. They are truly to be commended for their respectful decorum.</p><p>On the streets of Seoul, or in subway stations, you have only to pause with a questioning look to draw someone to your side offering assistance. It seems to be their goal in life to be helpful. Riding on the subways and buses, even middle-aged women will give up their seats to someone older, handicapped, pregnant, or carrying a child. And I loved their habit of bowing to you as you go in and out of places of business. Their politeness is inspiring.</p><p>The most lasting impression, though, was the women--meek and mild are the words that come to mind. And they have beautiful smiles. Their modest clothing seemed to be in sharp contrast to that in other parts of the world where women are taken in by fashions that leave much to be desired. Sometimes we don't see ourselves as we are until compared with those who are different. In 1Timothy 2:9 and 10 Paul admonishes those who claim godliness to dress properly.</p><p>Whether it's respect, humility, politeness, or modesty, if we try to be just a little better than the culture around us we'll go downhill with it because it's getting worse with the passing of time. We should be a transforming example. My Korean trip was a wake-up call for me to live up to God's ideals--not the world's.</p><p><em>Lord, please help us renew our minds so we can be transformed to follow Your will instead of our own.</em></p><p><DIV ALIGN=RIGHT>--Donna Meyer Voth</div></p>","94"
